{
	"$schema": "../../schemas/gateway-v2.schema.json",
	"id": "paypal",
	"chismografo": {
		"tipo": 3,
		"version": 1,
		"ultimaActualizacion": "2026-09-11",
		"revision": 0,
		"entorno": 0
	},
	"acercaDe": {
		"detallesGenerales": {
			"nombre": "PayPal",
			"web": "https://paypal.com",
			"categoria": "Pasarela de Pago",
			"logo": {
				"id": "paypal.com",
				"proveedor": "logodev"
			}
		},
		"cmsCompatibles": [
			{
				"id": "shopify",
				"comisionMinima": 2,
				"comisionMaxima": 3.6
			},
			{
				"id": "woocommerce",
				"comisionMinima": 2,
				"comisionMaxima": 3.6
			}
		],
		"precios": []
	},
	"herramienta": {
		"reglasDeteccion": [
			{
				"tipo": "script-src",
				"patron": "paypal\\.com/sdk/js|checkout\\.js|paypal-objects",
				"descripcion": "Script de integración de PayPal detectado"
			},
			{
				"tipo": "html",
				"patron": "payment_method_paypal|\\bpaypal\\b|\\bpay-pal\\b",
				"descripcion": "Clase o marca HTML de PayPal detectada"
			}
		]
	}
}
