{
	"$schema": "../../schemas/gateway-v2.schema.json",
	"id": "dlocal",
	"chismografo": {
		"tipo": 3,
		"version": 1,
		"ultimaActualizacion": "2026-09-11",
		"revision": 0,
		"entorno": 0
	},
	"acercaDe": {
		"detallesGenerales": {
			"nombre": "dLocal",
			"web": "https://dlocal.com",
			"categoria": "Pasarela de Pago",
			"logo": {
				"id": "dlocal.com",
				"proveedor": "logodev"
			}
		},
		"cmsCompatibles": [
			{
				"id": "shopify",
				"comisionMinima": 2,
				"comisionMaxima": 3.6
			},
			{
				"id": "woocommerce",
				"comisionMinima": 2,
				"comisionMaxima": 3.6
			}
		],
		"precios": []
	},
	"herramienta": {
		"reglasDeteccion": [
			{
				"tipo": "script-src",
				"patron": "dlocal\\.com|dlocal-sdk",
				"descripcion": "Script de integración de dLocal detectado"
			},
			{
				"tipo": "html",
				"patron": "\\bdlocal\\b",
				"descripcion": "Clase o marca HTML de dLocal detectada"
			}
		]
	}
}
