{
	"$schema": "../../schemas/gateway-v2.schema.json",
	"id": "conekta",
	"chismografo": {
		"tipo": 3,
		"version": 1,
		"ultimaActualizacion": "2026-09-11",
		"revision": 0,
		"entorno": 0
	},
	"acercaDe": {
		"detallesGenerales": {
			"nombre": "Conekta",
			"web": "https://conekta.com",
			"categoria": "Pasarela de Pago",
			"logo": {
				"id": "conekta.com",
				"proveedor": "logodev"
			}
		},
		"cmsCompatibles": [
			{
				"id": "shopify",
				"comisionMinima": 2,
				"comisionMaxima": 3.6
			},
			{
				"id": "woocommerce",
				"comisionMinima": 2,
				"comisionMaxima": 3.6
			}
		],
		"precios": []
	},
	"herramienta": {
		"reglasDeteccion": [
			{
				"tipo": "script-src",
				"patron": "conekta\\.js|cdn\\.conekta\\.io",
				"descripcion": "Script de integración de Conekta detectado"
			},
			{
				"tipo": "html",
				"patron": "\\bconekta\\b",
				"descripcion": "Clase o marca HTML de Conekta detectada"
			}
		]
	}
}
