{
	"$schema": "../../schemas/gateway-v2.schema.json",
	"id": "stripe",
	"chismografo": {
		"tipo": 3,
		"version": 1,
		"ultimaActualizacion": "2026-09-11",
		"revision": 0,
		"entorno": 0
	},
	"acercaDe": {
		"detallesGenerales": {
			"nombre": "Stripe",
			"web": "https://stripe.com",
			"categoria": "Pasarela de Pago",
			"logo": {
				"id": "stripe.com",
				"proveedor": "logodev"
			}
		},
		"cmsCompatibles": [
			{
				"id": "shopify",
				"comisionMinima": 2,
				"comisionMaxima": 3.6
			},
			{
				"id": "woocommerce",
				"comisionMinima": 2,
				"comisionMaxima": 3.6
			}
		],
		"precios": []
	},
	"herramienta": {
		"reglasDeteccion": [
			{
				"tipo": "script-src",
				"patron": "js\\.stripe\\.com/v[23]/?|stripe-js",
				"descripcion": "Script de integración de Stripe detectado"
			},
			{
				"tipo": "html",
				"patron": "woocommerce-gateways|payment_method_stripe|\\bstripe\\b",
				"descripcion": "Clase o marca HTML de Stripe detectada"
			}
		]
	}
}
