{
	"$schema": "../../schemas/gateway-v2.schema.json",
	"id": "adyen",
	"chismografo": {
		"tipo": 3,
		"version": 1,
		"ultimaActualizacion": "2026-09-11",
		"revision": 0,
		"entorno": 0
	},
	"acercaDe": {
		"detallesGenerales": {
			"nombre": "Adyen",
			"web": "https://adyen.com",
			"categoria": "Pasarela de Pago",
			"logo": {
				"id": "adyen.com",
				"proveedor": "logodev"
			}
		},
		"cmsCompatibles": [
			{
				"id": "shopify",
				"comisionMinima": 2,
				"comisionMaxima": 3.6
			},
			{
				"id": "woocommerce",
				"comisionMinima": 2,
				"comisionMaxima": 3.6
			}
		],
		"precios": []
	},
	"herramienta": {
		"reglasDeteccion": [
			{
				"tipo": "script-src",
				"patron": "adyen\\.com|adyen\\.js",
				"descripcion": "Script de integración de Adyen detectado"
			},
			{
				"tipo": "html",
				"patron": "\\badyen\\b",
				"descripcion": "Clase o marca HTML de Adyen detectada"
			}
		]
	}
}
